{
  "schemaVersion": 1,
  "subjectSlug": "quantitative-aptitude",
  "subjectName": "Quantitative Aptitude",
  "subjectPosition": 1,
  "chapterSlug": "data-interpretation",
  "chapterName": "Data Interpretation",
  "chapterPosition": 4,
  "topicSlug": "introduction-to-data-interpretation",
  "topicPosition": 10,
  "title": "Introduction to Data Interpretation",
  "summary": "What a data interpretation set is, the formats it comes in, the handful of question types that keep recurring, and the habit of reading the whole set before touching a calculation.",
  "difficulty": "intermediate",
  "estimatedMinutes": 24,
  "examTags": ["sbi-po", "sbi-clerk", "ibps-po", "ibps-clerk"],
  "prerequisiteTopicSlugs": ["percentages", "ratio-and-proportion", "average"],
  "learningObjectives": [
    "Recognise the six standard ways a data set is presented and what each is good for.",
    "Name the recurring sub-question types so you can classify an item on sight.",
    "Read the title, units and every question before starting the arithmetic.",
    "Apply the 'what percent more or less' relationship with the correct base."
  ],
  "tags": ["data-interpretation", "di-basics", "bank-exams"],
  "contentStatus": "published",
  "contentVersion": 1,
  "authoredBy": "content-pipeline",
  "lastReviewedAt": null,
  "reviewCadenceDays": 365,
  "sources": [
    {
      "sourceId": "WIKIBOOKS_MATH",
      "url": "https://en.wikibooks.org/wiki/Arithmetic/Percents_Decimals_and_Fractions",
      "title": "Arithmetic/Percents Decimals and Fractions",
      "publisher": "Wikibooks contributors",
      "usageMode": "open_adaptable",
      "license": "CC-BY-SA-4.0",
      "retrievedAt": "2026-09-02T00:00:00Z",
      "adapted": false,
      "notes": "Used only to cross-check the percentage-change and ratio arithmetic that DI questions rest on. Every data set, worked example and practice item here is original."
    },
    {
      "sourceId": "WIKIBOOKS_COPYRIGHT",
      "url": "https://en.wikibooks.org/wiki/Wikibooks:Copyrights",
      "title": "Wikibooks:Copyrights",
      "publisher": "Wikibooks contributors",
      "usageMode": "policy",
      "retrievedAt": "2026-09-02T00:00:00Z",
      "notes": "Attribution and ShareAlike terms checked for the reference page above."
    },
    {
      "sourceId": "SATHEE_BANK",
      "url": "https://sathee.iitk.ac.in/sathee-bank-exam/",
      "title": "SATHEE Bank Exam",
      "publisher": "Ministry of Education / IIT Kanpur",
      "usageMode": "scope_only",
      "retrievedAt": "2026-09-02T00:00:00Z",
      "notes": "Consulted only to confirm that data interpretation is a standard scored section. No lesson text or question was reused."
    }
  ],
  "blocks": [
    {
      "id": "what-di-questions-are",
      "type": "introduction",
      "title": "What a data interpretation set is",
      "markdown": "A data interpretation set gives you one block of data and then three to five questions that all draw on it. The data can be shown as a **table**, a **bar chart**, a **line graph**, a **pie chart**, a **caselet** (the numbers are buried in a paragraph), or a **mixed** set that combines two of these.\n\nThe arithmetic itself is light: additions, a division or two, a percentage, a ratio. What the section actually tests is whether you can pull the right figures out of the presentation quickly and without misreading them. Treat the data as a small reference table you will consult five times, not as something to memorise.",
      "sourceIds": ["WIKIBOOKS_MATH", "SATHEE_BANK"],
      "searchKeywords": [
        "what is data interpretation",
        "table bar line pie caselet mixed",
        "one data set several questions"
      ],
      "position": 10
    },
    {
      "id": "sub-question-types",
      "type": "concept",
      "title": "The question types that keep recurring",
      "markdown": "Almost every DI item is one of these, so classify it before you compute:\n\n- **Read a single value.** Straight lookup, sometimes after a unit conversion.\n- **Total or average** of a row, a column, or a named group.\n- **Percentage change** between two years or two points.\n- **Ratio** between two quantities, usually wanted in lowest terms.\n- **What percent more or less** one quantity is than another.\n- **Approximate value** — the options are far apart, so round hard and move on.\n- **Combined category** — add two segments, or compare one segment against the sum of two others.\n\nA set of five questions usually spreads across four or five of these types.",
      "sourceIds": ["WIKIBOOKS_MATH"],
      "searchKeywords": [
        "di question types",
        "single value total average percentage change ratio",
        "percent more or less approximate combined category"
      ],
      "position": 20
    },
    {
      "id": "read-before-you-calculate",
      "type": "method",
      "title": "Read the whole set first",
      "markdown": "1. **Read the title and the units.** \"Sales in ₹ lakh\", \"Accounts in hundreds\", \"figures are percentages\" — the units decide half the wrong answers.\n2. **Check whether the figures are absolute or relative.** A pie in per cent needs a total before any value can be found; a table of absolute numbers does not.\n3. **Skim all the questions before the first calculation.** You will often compute a row total once and reuse it in three questions.\n4. **Note what is asked for**, exactly: a value, a percentage, a ratio, an approximate figure. Answering in the wrong form is a common, avoidable loss.\n5. **Keep your intermediate totals written down** so you are not re-adding the same column.",
      "sourceIds": ["WIKIBOOKS_MATH"],
      "searchKeywords": [
        "read the whole di set first",
        "check title and units",
        "absolute versus relative figures",
        "reuse row totals scan all questions"
      ],
      "position": 30
    },
    {
      "id": "percent-more-or-less",
      "type": "formula",
      "title": "\"What percent more or less\"",
      "markdown": "This phrasing trips people because the base changes with the wording.\n\n- **A is what per cent more than B**: divide the difference by **B** (the thing being compared against), then multiply by 100. That is (A − B) ÷ B × 100.\n- **A is what per cent less than B**: same shape, still divided by **B**. That is (B − A) ÷ B × 100.\n\nThe base is always the quantity that comes after \"than\". Going from 90 to 108 is an increase of 18 on a base of 90, which is 20 per cent more. Going back from 108 to 90 is a decrease of 18 on a base of 108, which is about 16.67 per cent less. The two are not the same number because the base is different.",
      "sourceIds": ["WIKIBOOKS_MATH"],
      "searchKeywords": [
        "what percent more than",
        "what percent less than",
        "base is the quantity after than",
        "difference over base times 100"
      ],
      "position": 40
    },
    {
      "id": "worked-example-small-table",
      "type": "worked_example",
      "title": "Worked example: a three-branch table",
      "markdown": "Deposits and loans of three branches, in ₹ crore:\n\n| Branch | Deposits | Loans |\n| ------ | -------- | ----- |\n| A | 120 | 90 |\n| B | 150 | 120 |\n| C | 180 | 108 |\n\n**Q1. Total deposits of the three branches.** Add the deposits column: 120 + 150 + 180 = 450 crore.\n\n**Q2. Branch B's deposits as a percentage of the total.** 150 ÷ 450 × 100 = 33.33 per cent. The total from Q1 is reused here.\n\n**Q3. Ratio of loans to deposits for Branch A.** 90 ÷ 120 = 0.75, i.e. 3 : 4.\n\n**Q4. By what per cent do Branch C's loans exceed Branch A's loans?** Base is A's loans: (108 − 90) ÷ 90 × 100 = 20 per cent.",
      "sourceIds": ["WIKIBOOKS_MATH"],
      "searchKeywords": [
        "di worked example three branch table deposits loans",
        "row total percentage of total ratio percent excess"
      ],
      "position": 50,
      "expectedAnswers": [
        {
          "label": "total deposits (crore)",
          "value": 450,
          "expression": "120+150+180"
        },
        {
          "label": "B deposits as % of total",
          "value": 33.33,
          "tolerance": 0.01,
          "expression": "150/450*100"
        },
        {
          "label": "loans-to-deposits ratio for A",
          "value": 0.75,
          "expression": "90/120"
        },
        {
          "label": "% by which C loans exceed A loans",
          "value": 20,
          "expression": "(108-90)/90*100"
        }
      ]
    },
    {
      "id": "common-mistakes",
      "type": "warning",
      "title": "Common mistakes",
      "markdown": "- **Using the wrong base** for a change or a \"percent more/less\" — the base is the starting value, or the quantity after \"than\".\n- **Mixing units** — adding a figure in lakh to one in crore, or treating a percentage as an absolute count.\n- **Reading across the wrong row or column**, especially in a wide table under time pressure.\n- **Over-precision** — carrying four decimals when the options are 10 apart. Round early on approximate questions.\n- **Recomputing a shared total** for each question instead of writing it down once.\n- **Answering in the wrong form** — giving a value when a ratio was asked for.",
      "sourceIds": ["WIKIBOOKS_MATH"],
      "searchKeywords": [
        "di common mistakes",
        "wrong base mixed units wrong row",
        "over precision recomputing totals wrong form"
      ],
      "position": 60
    },
    {
      "id": "quick-revision",
      "type": "summary",
      "title": "Quick revision",